{
  "bundle_id": "tb-conformance-signed-001",
  "routing_decision": {
    "id": "rd-conf-001",
    "choice_cards": [
      {
        "id": "card-retrieval",
        "context_hint": "Select a retrieval action.",
        "items": [
          {
            "id": "search-docs",
            "label": "Search documentation",
            "description": "Full-text search across the docs index.",
            "capability_id": "org.myapp.search_docs"
          }
        ]
      }
    ],
    "selected_item_id": "search-docs",
    "selected_card_id": "card-retrieval",
    "timestamp": "2026-03-08T06:00:00Z"
  },
  "policy_decisions": [
    {
      "decision_id": "pd-conf-001",
      "decision": "allow",
      "capability_id": "org.myapp.search_docs",
      "principal": "agent-session-9c2e",
      "token_id": "tok-conf-001",
      "timestamp": "2026-03-08T06:00:01Z"
    }
  ],
  "frames": [
    {
      "frame_id": "frame-conf-001",
      "capability_id": "org.myapp.search_docs",
      "summary": "Found 2 documentation pages matching the query.",
      "handle_refs": [
        "handle-conf-001"
      ],
      "created_at": "2026-03-08T06:00:05Z"
    }
  ],
  "handles": [
    {
      "handle_id": "handle-conf-001",
      "capability_id": "org.myapp.search_docs",
      "artifact_type": "application/json",
      "created_at": "2026-03-08T06:00:05Z",
      "expires_at": "2026-03-09T06:00:05Z"
    }
  ],
  "trace_events": [
    {
      "event_id": "te-conf-001",
      "event_type": "capability_executed",
      "timestamp": "2026-03-08T06:00:05Z",
      "capability_id": "org.myapp.search_docs",
      "principal": "agent-session-9c2e",
      "decision_id": "pd-conf-001",
      "frame_id": "frame-conf-001",
      "handle_id": "handle-conf-001",
      "outcome": "success"
    }
  ],
  "canonicalization": "JCS",
  "created_at": "2026-03-08T06:00:06Z",
  "signature": {
    "alg": "ed25519",
    "kid": "conformance-test-ed25519-2026-01",
    "sig": "LRB1K8fbJPQNdTbKjrEkzFQWmoiXok-KYARdrSuRJhMJTIOSONgK0gK5W2tdDW5s54z9QycbEwQAMONBX81JDw",
    "canonicalization": "JCS",
    "signed_at": "2026-03-08T06:00:06Z"
  }
}
