{
  "bundle_id": "tb-20260308-signed-001",
  "routing_decision": {
    "id": "rd-20260308-002",
    "choice_cards": [
      {
        "id": "card-retrieval",
        "context_hint": "Select the most appropriate document retrieval action.",
        "items": [
          {
            "id": "search-docs",
            "label": "Search documentation",
            "description": "Full-text search across the product documentation index.",
            "capability_id": "org.myapp.search_docs"
          }
        ]
      }
    ],
    "selected_item_id": "search-docs",
    "selected_card_id": "card-retrieval",
    "timestamp": "2026-03-08T06:00:00Z"
  },
  "policy_decisions": [
    {
      "decision_id": "pd-20260308-002",
      "decision": "allow",
      "capability_id": "org.myapp.search_docs",
      "principal": "agent-session-7f3a",
      "token_id": "tok-20260308-abc123",
      "timestamp": "2026-03-08T06:00:01Z"
    }
  ],
  "frames": [
    {
      "frame_id": "frame-20260308-002",
      "capability_id": "org.myapp.search_docs",
      "summary": "Found 3 documentation pages matching 'retry configuration'.",
      "handle_refs": ["handle-rawresult-20260308-002"],
      "created_at": "2026-03-08T06:00:05Z"
    }
  ],
  "handles": [
    {
      "handle_id": "handle-rawresult-20260308-002",
      "capability_id": "org.myapp.search_docs",
      "artifact_type": "application/json",
      "created_at": "2026-03-08T06:00:05Z",
      "expires_at": "2026-03-09T06:00:05Z"
    }
  ],
  "trace_events": [
    {
      "event_id": "te-20260308-006",
      "event_type": "capability_executed",
      "timestamp": "2026-03-08T06:00:05Z",
      "capability_id": "org.myapp.search_docs",
      "principal": "agent-session-7f3a",
      "decision_id": "pd-20260308-002",
      "frame_id": "frame-20260308-002",
      "handle_id": "handle-rawresult-20260308-002",
      "outcome": "success"
    }
  ],
  "canonicalization": "JCS",
  "created_at": "2026-03-08T06:00:06Z",
  "signature": {
    "alg": "ed25519",
    "kid": "agent-kernel-2026-05-key-01",
    "sig": "CxIZICcuNTxDSlFYX2ZtdHuCiZCXnqWss7rByM_W3eTr8vkABw4VHCMqMTg_Rk1UW2JpcHd-hYyTmqGor7a9xA",
    "canonicalization": "JCS",
    "signed_at": "2026-03-08T06:00:06Z"
  }
}
