{
  "bundle_id": "tb-20260308-001",
  "routing_decision": {
    "id": "rd-20260308-001",
    "choice_cards": [
      {
        "id": "card-retrieval",
        "context_hint": "Select the most appropriate document retrieval action for the user's query.",
        "items": [
          {
            "id": "search-docs",
            "label": "Search documentation",
            "description": "Full-text search across the product documentation index.",
            "capability_id": "org.myapp.search_docs"
          },
          {
            "id": "fetch-page",
            "label": "Fetch a specific page",
            "description": "Retrieve a known documentation page by its slug.",
            "capability_id": "org.myapp.fetch_doc_page"
          }
        ]
      }
    ],
    "selected_item_id": "search-docs",
    "selected_card_id": "card-retrieval",
    "timestamp": "2026-03-08T06:00:00Z",
    "context_summary": "User asked: 'How do I configure retries?'. Routing to documentation retrieval."
  },
  "policy_decisions": [
    {
      "decision_id": "pd-20260308-001",
      "decision": "allow",
      "capability_id": "org.myapp.search_docs",
      "principal": "agent-session-7f3a",
      "token_id": "tok-20260308-abc123",
      "reason": "Token scope includes org.myapp.search_docs; token unexpired; principal authorized for documentation retrieval.",
      "timestamp": "2026-03-08T06:00:01Z"
    }
  ],
  "frames": [
    {
      "frame_id": "frame-20260308-001",
      "capability_id": "org.myapp.search_docs",
      "summary": "Found 3 documentation pages matching 'retry configuration'. The most relevant is 'Retry Policies Overview'.",
      "handle_refs": ["handle-rawresult-20260308-001"],
      "redaction_notes": "Raw search index response stored as Handle. Only titles, slugs, and relevance scores summarized.",
      "created_at": "2026-03-08T06:00:05Z"
    }
  ],
  "handles": [
    {
      "handle_id": "handle-rawresult-20260308-001",
      "capability_id": "org.myapp.search_docs",
      "artifact_type": "application/json",
      "created_at": "2026-03-08T06:00:05Z",
      "expires_at": "2026-03-09T06:00:05Z",
      "access_policy": "policy://agent-kernel/handle-default",
      "byte_size": 18432
    }
  ],
  "trace_events": [
    {
      "event_id": "te-20260308-005",
      "event_type": "capability_executed",
      "timestamp": "2026-03-08T06:00:05Z",
      "capability_id": "org.myapp.search_docs",
      "principal": "agent-session-7f3a",
      "decision_id": "pd-20260308-001",
      "frame_id": "frame-20260308-001",
      "handle_id": "handle-rawresult-20260308-001",
      "outcome": "success"
    }
  ],
  "canonicalization": "JCS",
  "created_at": "2026-03-08T06:00:06Z",
  "metadata": {
    "audit_log_sequence_range": [24890, 24891]
  }
}
